{
  "fixture_version": 4,
  "name": "phase0-synthetic-bitemporal-ledger-v4",
  "data_class": "SYNTHETIC_ONLY",
  "network_egress": "NONE",
  "contract": {
    "envelope": "academic.signed-batch-envelope/v1 deterministic-cbor",
    "payload": "academic.event-batch/v4 deterministic-cbor",
    "signature": "Ed25519",
    "event_schema_version": 4
  },
  "device_id": "01900000-0000-7000-8000-00000000000a",
  "user_id": "01900000-0000-7000-8000-00000000000b",
  "public_key_hex": "ea4a6c63e29c520abef5507b132ec5f9954776aebebe7b92421eea691446d22c",
  "signed_batch_cbor_hex": "8401594d7a820588826862617463685f69648203782430313930303030302d303030302d373030302d383030302d30303030303030303030303982696465766963655f69648203782430313930303030302d303030302d373030302d383030302d30303030303030303030306182666576656e74738204982082058682656163746f7282058382646b696e64820368494d504f5254455282646e616d658203781a73796e7468657469632e6f6666696369616c2e66697874757265826776657273696f6e820365312e302e308269646f6d61696e5f69648203782430313930303030302d303030302d373030302d383030302d303030303030303030303031826269648203782430313930303030302d303030302d373030302d383030302d30303030303030303030303182726f726967696e5f6f627365727665645f6174820263313031826a6f726967696e5f7365718202613182677061796c6f616482058282646b696e6482037053434f50455f52454749535445524544826576616c75658205838269646f6d61696e5f69648203782430313930303030302d303030302d373030302d383030302d303030303030303030303031826269648203782430313930303030302d303030302d373030302d383030302d30303030303030303030303782656c6162656c8203767068617365302e73796e7468657469632e73636f706582058682656163746f7282058382646b696e64820368494d504f5254455282646e616d658203781a73796e7468657469632e6f6666696369616c2e66697874757265826776657273696f6e820365312e302e308269646f6d61696e5f69648203782430313930303030302d303030302d373030302d383030302d303030303030303030303031826269648203782430313930303030302d303030302d373030302d383030302d30303030303030303030303282726f726967696e5f6f627365727665645f6174820263313032826a6f726967696e5f7365718202613282677061796c6f616482058282646b696e6482037341525449464143545f52454749535445524544826576616c756582058b826b627974655f6c656e6774688202623533826f636f6e666964656e7469616c697479820368504552534f4e414c826e636f6e74656e745f646967657374820378477368613235363a306161363861303535633765313462336233616136373330656134653431333561336433333635633866373532343964343463373361306462623562383133348269646f6d61696e5f69648203782430313930303030302d303030302d373030302d383030302d30303030303030303030303182781865766964656e63655f726570726573656e746174696f6e73820481820583826b627974655f6c656e6774688202623533826e636f6e74656e745f646967657374820378477368613235363a3061613638613035356337653134623362336161363733306561346534313335613364333336356338663735323439643434633733613064626235623831333482676c6f6361746f728205848263656e64820262353382646b696e6482036a544558545f4259544553826d736f757263655f646967657374820378477368613235363a306161363861303535633765313462336233616136373330656134653431333561336433333635633866373532343964343463373361306462623562383133348265737461727482026130826e666f726d61745f76657273696f6e82026131826269648203782430313930303030302d303030302d373030302d383030302d303030303030303030303033826a6d656469615f7479706582036a746578742f706c61696e82757065726d697373696f6e5f6c696e656167655f69648203782430313930303030302d303030302d373030302d383030302d303030303030303030303032826f726574656e74696f6e5f636c61737382036c555345525f4d414e41474544826d7661756c745f6c6f6361746f728203784b6c6f6361746f723a76313a3236663839353366343939663736616435636334326665623533646536376231633662346466323236356463366264666637623732383137383564356230666182058682656163746f7282058382646b696e64820368494d504f5254455282646e616d658203781a73796e7468657469632e6f6666696369616c2e66697874757265826776657273696f6e820365312e302e308269646f6d61696e5f69648203782430313930303030302d303030302d373030302d383030302d303030303030303030303031826269648203782430313930303030302d303030302d373030302d383030302d30303030303030303030303382726f726967696e5f6f627365727665645f6174820263313033826a6f726967696e5f7365718202613382677061796c6f616482058282646b696e6482037345564944454e43455f52454749535445524544826576616c7565820588826b61727469666163745f69648203782430313930303030302d303030302d373030302d383030302d303030303030303030303033826e657863657270745f646967657374820378477368613235363a30616136386130353563376531346233623361613637333065613465343133356133643333363563386637353234396434346337336130646262356238313334827165787472616374696f6e5f6d6574686f64820378187068617365302e73796e7468657469632e666978747572658271657874726163746f725f76657273696f6e820365312e302e30826269648203782430313930303030302d303030302d373030302d383030302d30303030303030303030303482676c6f6361746f728205848263656e64820262353382646b696e6482036a544558545f4259544553826d736f757263655f646967657374820378477368613235363a3061613638613035356337653134623362336161363733306561346534313335613364333336356338663735323439643434633733613064626235623831333482657374617274820261308264726f6c65820368535550504f5254538268737472656e67746882036644495245435482058682656163746f7282058282646b696e648203694d4f44454c5f52554e826672756e5f69648203782430313930303030302d303030302d373030302d383030302d3030303030303030303030388269646f6d61696e5f69648203782430313930303030302d303030302d373030302d383030302d303030303030303030303031826269648203782430313930303030302d303030302d373030302d383030302d30303030303030303030303482726f726967696e5f6f627365727665645f6174820263313034826a6f726967696e5f7365718202613482677061796c6f616482058282646b696e6482036e434c41494d5f4153534552544544826576616c756582058a826f617574686f726974795f636c61737382036f4d4f44454c5f494e464552454e4345826a636f6e666964656e636582026337323082706570697374656d69635f73746174757382036b41495f494e464552524544826c65766964656e63655f6964738204818203782430313930303030302d303030302d373030302d383030302d303030303030303030303034826269648203782430313930303030302d303030302d373030302d383030302d30303030303030303032303182666f626a6563748205828264747970658203674d415354455259826576616c756582036a554e44455253544f4f44826c7072656469636174655f69648203716b6e6f776c656467652e6d617374657279826873636f70655f69648203782430313930303030302d303030302d373030302d383030302d30303030303030303030303782717375626a6563745f656e746974795f69648203782430313930303030302d303030302d373030302d383030302d303030303030303030303035826a76616c69645f74696d65820582826466726f6d8202633130308262746f810082058682656163746f7282058282646b696e64820364555345528267757365725f69648203782430313930303030302d303030302d373030302d383030302d3030303030303030303030628269646f6d61696e5f69648203782430313930303030302d303030302d373030302d383030302d303030303030303030303031826269648203782430313930303030302d303030302d373030302d383030302d30303030303030303030303582726f726967696e5f6f627365727665645f6174820263313035826a6f726967696e5f7365718202613582677061796c6f616482058282646b696e648203714445434953494f4e5f5245434f52444544826576616c75658205898266616374696f6e8205818266616374696f6e82036652454a454354826a646563696465645f6174820263313034826269648203782430313930303030302d303030302d373030302d383030302d3030303030303030303330318276726174696f6e616c655f65766964656e63655f6964738204818203782430313930303030302d303030302d373030302d383030302d303030303030303030303034826f7265736f6c7574696f6e5f736c6f74820583826c7072656469636174655f69648203716b6e6f776c656467652e6d617374657279826873636f70655f69648203782430313930303030302d303030302d373030302d383030302d30303030303030303030303782717375626a6563745f656e746974795f69648203782430313930303030302d303030302d373030302d383030302d303030303030303030303035827072657665727369626c655f756e74696c8100826f7461726765745f636c61696d5f69648203782430313930303030302d303030302d373030302d383030302d303030303030303030323031826d7461726765745f6f626a6563748205828264747970658203674d415354455259826576616c756582036a554e44455253544f4f44826a76616c69645f74696d65820582826466726f6d8202633130308262746f810082058682656163746f7282058282646b696e64820364555345528267757365725f69648203782430313930303030302d303030302d373030302d383030302d3030303030303030303030628269646f6d61696e5f69648203782430313930303030302d303030302d373030302d383030302d303030303030303030303031826269648203782430313930303030302d303030302d373030302d383030302d30303030303030303030303682726f726967696e5f6f627365727665645f6174820263313036826a6f726967696e5f7365718202613682677061796c6f616482058282646b696e6482036e434c41494d5f4153534552544544826576616c756582058a826f617574686f726974795f636c61737382036d555345525f4558504c49434954826a636f6e666964656e63658202643130303082706570697374656d69635f73746174757382036e555345525f434f4e4649524d4544826c65766964656e63655f6964738204818203782430313930303030302d303030302d373030302d383030302d303030303030303030303034826269648203782430313930303030302d303030302d373030302d383030302d30303030303030303032303282666f626a6563748205828264747970658203674d415354455259826576616c7565820369505241435449434544826c7072656469636174655f69648203716b6e6f776c656467652e6d617374657279826873636f70655f69648203782430313930303030302d303030302d373030302d383030302d30303030303030303030303782717375626a6563745f656e746974795f69648203782430313930303030302d303030302d373030302d383030302d303030303030303030303035826a76616c69645f74696d65820582826466726f6d8202633230308262746f810082058682656163746f7282058282646b696e64820364555345528267757365725f69648203782430313930303030302d303030302d373030302d383030302d3030303030303030303030628269646f6d61696e5f69648203782430313930303030302d303030302d373030302d383030302d303030303030303030303031826269648203782430313930303030302d303030302d373030302d383030302d30303030303030303030303782726f726967696e5f6f627365727665645f6174820263313037826a6f726967696e5f7365718202613782677061796c6f616482058282646b696e648203714445434953494f4e5f5245434f52444544826576616c75658205898266616374696f6e8205818266616374696f6e820367434f4e4649524d826a646563696465645f6174820263313036826269648203782430313930303030302d303030302d373030302d383030302d3030303030303030303330328276726174696f6e616c655f65766964656e63655f69647382048182037824303139303